{
  "backend": {
    "kind": "none",
    "reason": "deterministic foundation evidence packaging; invoked tools are identified in the input and manifest"
  },
  "environment": {
    "dependenciesDigest": {
      "algorithm": "sha256",
      "value": "b939cb6c694c3f9fba16ec2ed0696aca6f200c774e51f78d5515bc4802ae0de0"
    },
    "operatingSystem": "Linux-6.18.33.2-microsoft-standard-WSL2-x86_64-with-glibc2.35",
    "targetTriple": "x86_64-unknown-linux-gnu",
    "toolchain": "rustc 1.94.1 (e408947bf 2026-03-25)"
  },
  "extensions": {
    "dev.agent-ix.codegen": {
      "componentClass": "direct-development-tool",
      "envelopeSchemaDigest": "0946e235e9e4b0fa79e9b9ec27ae157b303c17de0a9408d3cc04968fb7152256",
      "pgm01CandidateRevision": "0b8669b80f98b6c11954f922b32d9edae8a11983",
      "phase": "foundation",
      "reviewState": "pending",
      "sourceState": "clean",
      "historicalDisposition": {
        "authoritative": false,
        "reason": "superseded historical foundation record",
        "status": "retracted"
      }
    }
  },
  "inputs": [
    {
      "contentDigest": {
        "algorithm": "sha256",
        "value": "180ab181a47f0a529245b5036b596865563e3e8abb3cb70c7adbf6212010051f"
      },
      "mediaType": "application/json",
      "role": "foundation-evidence-collection-input",
      "schema": {
        "digest": {
          "algorithm": "sha256",
          "value": "1aa55cfa9814522e7a34949b3c212e9188fd5ad89d96d8ab7fe9e4037a361b33"
        },
        "id": "quire.codegen-foundation-evidence-input",
        "version": "v1"
      },
      "uri": "collection-input.json"
    }
  ],
  "outputs": [
    {
      "contentDigest": {
        "algorithm": "sha256",
        "value": "45a4da9018032df0bc83f0c6fc651569916ddb4e537d7009d127b0aca5707c3c"
      },
      "mediaType": "application/json",
      "role": "codegen-foundation-evidence-manifest",
      "schema": {
        "digest": {
          "algorithm": "sha256",
          "value": "05e92a537a4def39d50e0050667200fae648284afef603bcbf2c0e014e9b5be5"
        },
        "id": "quire.codegen-foundation-evidence-manifest",
        "version": "v1"
      },
      "uri": "evidence-manifest.json"
    }
  ],
  "parametersDigest": {
    "algorithm": "sha256",
    "value": "ef319b36a8e2d4ff27df60fd18d1930384778f98af8e11f817135f772d2dae4b"
  },
  "producer": {
    "executableDigest": {
      "algorithm": "sha256",
      "value": "bfac485f03683c912850546f186eeb330f531310d6e1a45da2eda1890342ed1f"
    },
    "invocation": [
      "scripts/collect_foundation_evidence.sh",
      "evidence/foundation-candidate"
    ],
    "name": "quire-contract-codegen-foundation-collector",
    "sourceRevision": "8db0acefa23d57741ad632cb8377183e832d8c4b",
    "version": "0.1.0"
  },
  "provenance": {
    "candidateRevision": "8db0acefa23d57741ad632cb8377183e832d8c4b",
    "contributionMethod": "agent-assisted",
    "repository": "https://github.com/agent-ix/quire-contract-codegen",
    "reviewers": [
      "@kreneskyp"
    ],
    "sourceRevision": "8db0acefa23d57741ad632cb8377183e832d8c4b"
  },
  "recordId": "codegen-foundation-8db0acefa23d",
  "recordedAt": "2026-08-30T21:29:21Z",
  "result": {
    "requirementRefs": [
      "PGM-01-R08",
      "PGM-01-R09",
      "MP-001"
    ],
    "status": "conclusive",
    "summary": "all collected codegen foundation checks passed; semantic claims are out of scope"
  },
  "schemaVersion": "quire.derivation-evidence/v1"
}
