{
  "backend": {
    "kind": "none",
    "reason": "deterministic foundation evidence packaging; invoked tools are identified in the input and manifest"
  },
  "environment": {
    "dependenciesDigest": {
      "algorithm": "sha256",
      "value": "b939cb6c694c3f9fba16ec2ed0696aca6f200c774e51f78d5515bc4802ae0de0"
    },
    "operatingSystem": "Linux-6.18.33.2-microsoft-standard-WSL2-x86_64-with-glibc2.35",
    "targetTriple": "x86_64-unknown-linux-gnu",
    "toolchain": "rustc 1.94.1 (e408947bf 2026-03-25)"
  },
  "extensions": {
    "dev.agent-ix.codegen": {
      "componentClass": "direct-development-tool",
      "envelopeSchemaDigest": "0946e235e9e4b0fa79e9b9ec27ae157b303c17de0a9408d3cc04968fb7152256",
      "pgm01CandidateRevision": "942670a0db78be57cfa9bdd6d04302b453781a49",
      "phase": "foundation",
      "reviewState": "pending",
      "sourceState": "clean",
      "historicalDisposition": {
        "authoritative": false,
        "reason": "superseded historical foundation record",
        "status": "retracted"
      }
    }
  },
  "inputs": [
    {
      "contentDigest": {
        "algorithm": "sha256",
        "value": "adfcd7cbe4590f83044ba8e297f2e79a952a4b1a12714782b95fbe95f2951298"
      },
      "mediaType": "application/json",
      "role": "foundation-evidence-collection-input",
      "schema": {
        "digest": {
          "algorithm": "sha256",
          "value": "f0efc0b63f8d46258af397ff65bb52a16860d27086baa65c856cdbe96eeb51d7"
        },
        "id": "quire.codegen-foundation-evidence-input",
        "version": "v1"
      },
      "uri": "collection-input.json"
    }
  ],
  "outputs": [
    {
      "contentDigest": {
        "algorithm": "sha256",
        "value": "849985c3e9dba577d8624184a219b31c871abe9f91873b2861050cd60a7025a2"
      },
      "mediaType": "application/json",
      "role": "codegen-foundation-evidence-manifest",
      "schema": {
        "digest": {
          "algorithm": "sha256",
          "value": "05e92a537a4def39d50e0050667200fae648284afef603bcbf2c0e014e9b5be5"
        },
        "id": "quire.codegen-foundation-evidence-manifest",
        "version": "v1"
      },
      "uri": "evidence-manifest.json"
    }
  ],
  "parametersDigest": {
    "algorithm": "sha256",
    "value": "d94381d7d529431c72593e86f69ba6f0f757c18142c7278409f3572aa1163ea0"
  },
  "producer": {
    "executableDigest": {
      "algorithm": "sha256",
      "value": "e22f84dc4dba7d925e8f4050c93aa5fee4e9dccce8e509e99c72fbe608d75ca0"
    },
    "invocation": [
      "scripts/collect_foundation_evidence.sh",
      "evidence/foundation-e8c701cfe024-20260831T002430Z"
    ],
    "name": "quire-contract-codegen-foundation-collector",
    "sourceRevision": "e8c701cfe02485034ac50257379e28dd5801a7d0",
    "version": "0.1.0"
  },
  "provenance": {
    "candidateRevision": "e8c701cfe02485034ac50257379e28dd5801a7d0",
    "contributionMethod": "agent-assisted",
    "repository": "https://github.com/agent-ix/quire-contract-codegen",
    "reviewers": [
      "@kreneskyp"
    ],
    "sourceRevision": "e8c701cfe02485034ac50257379e28dd5801a7d0"
  },
  "recordId": "foundation-e8c701cfe024-20260831T002430Z",
  "recordedAt": "2026-08-31T00:24:32Z",
  "result": {
    "requirementRefs": [
      "PGM-01-R08",
      "PGM-01-R09",
      "MP-001"
    ],
    "status": "conclusive",
    "summary": "all collected codegen foundation checks passed; semantic claims are out of scope"
  },
  "schemaVersion": "quire.derivation-evidence/v1"
}
