{
  "backend": {
    "kind": "none",
    "reason": "deterministic foundation evidence packaging; invoked tools are identified in the input and manifest"
  },
  "environment": {
    "dependenciesDigest": {
      "algorithm": "sha256",
      "value": "b939cb6c694c3f9fba16ec2ed0696aca6f200c774e51f78d5515bc4802ae0de0"
    },
    "operatingSystem": "Linux-6.18.33.2-microsoft-standard-WSL2-x86_64-with-glibc2.35",
    "targetTriple": "x86_64-unknown-linux-gnu",
    "toolchain": "rustc 1.94.1 (e408947bf 2026-03-25)"
  },
  "extensions": {
    "dev.agent-ix.codegen": {
      "componentClass": "direct-development-tool",
      "envelopeSchemaDigest": "0946e235e9e4b0fa79e9b9ec27ae157b303c17de0a9408d3cc04968fb7152256",
      "pgm01CandidateRevision": "7dac9d8c19952412b56a0347387666e2ca81e01d",
      "phase": "foundation",
      "reviewState": "pending",
      "reviewerRole": "reviewer-of-record; not a GitHub approval",
      "sourceState": "clean"
    }
  },
  "inputs": [
    {
      "contentDigest": {
        "algorithm": "sha256",
        "value": "0de74a0afe2bfebf07e35cae72c1db33a68ce6f62b9203f3c180b00858ee366a"
      },
      "mediaType": "application/json",
      "role": "foundation-evidence-collection-input",
      "schema": {
        "digest": {
          "algorithm": "sha256",
          "value": "a3e396b63985069a90962022167f010a33cbffb813fb7074c846665aa26cc0e3"
        },
        "id": "quire.codegen-foundation-evidence-input",
        "version": "v1"
      },
      "uri": "collection-input.json"
    },
    {
      "contentDigest": {
        "algorithm": "sha256",
        "value": "0946e235e9e4b0fa79e9b9ec27ae157b303c17de0a9408d3cc04968fb7152256"
      },
      "mediaType": "application/schema+json",
      "role": "pgm01-envelope-schema",
      "schema": {
        "digest": {
          "algorithm": "sha256",
          "value": "0946e235e9e4b0fa79e9b9ec27ae157b303c17de0a9408d3cc04968fb7152256"
        },
        "id": "quire.derivation-evidence",
        "version": "v1"
      },
      "uri": "https://github.com/agent-ix/quire-contract-ir/blob/7dac9d8c19952412b56a0347387666e2ca81e01d/schemas/derivation-evidence-envelope-v1.schema.json"
    },
    {
      "contentDigest": {
        "algorithm": "sha256",
        "value": "1c2881d5f8800dab031f6afa26d5ad11f88a5ab42a942bc9fe0c2853b58df2f1"
      },
      "mediaType": "text/x-python",
      "role": "pgm01-governance-validator",
      "schema": {
        "digest": {
          "algorithm": "sha256",
          "value": "1c2881d5f8800dab031f6afa26d5ad11f88a5ab42a942bc9fe0c2853b58df2f1"
        },
        "id": "python-source",
        "version": "v3"
      },
      "uri": "https://github.com/agent-ix/quire-contract-ir/blob/5c49ebfd1c87415f74420ad047392bd03b1bd202/scripts/validate_governance.py"
    }
  ],
  "outputs": [
    {
      "contentDigest": {
        "algorithm": "sha256",
        "value": "3eb8ff0fa311eed017e3d1003562230fa8b5778cb802b9ab71acbccf8d740198"
      },
      "mediaType": "application/json",
      "role": "codegen-foundation-evidence-manifest",
      "schema": {
        "digest": {
          "algorithm": "sha256",
          "value": "05e92a537a4def39d50e0050667200fae648284afef603bcbf2c0e014e9b5be5"
        },
        "id": "quire.codegen-foundation-evidence-manifest",
        "version": "v1"
      },
      "uri": "evidence-manifest.json"
    }
  ],
  "parametersDigest": {
    "algorithm": "sha256",
    "value": "4ff03c824376cd0f73deeea5b838b061f3634b32003eb2780e689260b64ba223"
  },
  "producer": {
    "executableDigest": {
      "algorithm": "sha256",
      "value": "5738e2f0daa48396128cebfadeac414e74ea09bf83f51c215e74417fd7d72946"
    },
    "invocation": [
      "scripts/collect_foundation_evidence.sh",
      "evidence/foundation-35f526287109-20260831T203710Z"
    ],
    "name": "quire-contract-codegen-foundation-collector",
    "sourceRevision": "35f5262871094cabc117e9db8d06aae3c479371f",
    "version": "0.1.0"
  },
  "provenance": {
    "candidateRevision": "35f5262871094cabc117e9db8d06aae3c479371f",
    "contributionMethod": "agent-assisted",
    "repository": "https://github.com/agent-ix/quire-contract-codegen",
    "reviewers": [
      "@kreneskyp"
    ],
    "sourceRevision": "35f5262871094cabc117e9db8d06aae3c479371f"
  },
  "recordId": "foundation-35f526287109-20260831T203710Z",
  "recordedAt": "2026-08-31T20:37:13Z",
  "result": {
    "requirementRefs": [
      "PGM-01-R08",
      "PGM-01-R09",
      "MP-001"
    ],
    "status": "pending",
    "summary": "foundation outcomes: 1 inconclusive"
  },
  "schemaVersion": "quire.derivation-evidence/v1"
}
