{
  "backend": {
    "kind": "none",
    "reason": "deterministic foundation evidence packaging; invoked tools are identified in the input and manifest"
  },
  "environment": {
    "dependenciesDigest": {
      "algorithm": "sha256",
      "value": "b939cb6c694c3f9fba16ec2ed0696aca6f200c774e51f78d5515bc4802ae0de0"
    },
    "operatingSystem": "Linux-6.18.33.2-microsoft-standard-WSL2-x86_64-with-glibc2.35",
    "targetTriple": "x86_64-unknown-linux-gnu",
    "toolchain": "rustc 1.94.1 (e408947bf 2026-03-25)"
  },
  "extensions": {
    "dev.agent-ix.codegen": {
      "componentClass": "direct-development-tool",
      "envelopeSchemaDigest": "0946e235e9e4b0fa79e9b9ec27ae157b303c17de0a9408d3cc04968fb7152256",
      "pgm01CandidateRevision": "7f8130d3fdb160a98a7a7f445cc1eb7419a3c179",
      "phase": "foundation",
      "reviewState": "pending",
      "sourceState": "clean",
      "historicalDisposition": {
        "authoritative": false,
        "reason": "superseded historical foundation record",
        "status": "retracted"
      }
    }
  },
  "inputs": [
    {
      "contentDigest": {
        "algorithm": "sha256",
        "value": "2af410bcb94cf9e0e9b04070503c0e08ac85b5b4fa1357079fd245240dc86ccf"
      },
      "mediaType": "application/json",
      "role": "foundation-evidence-collection-input",
      "schema": {
        "digest": {
          "algorithm": "sha256",
          "value": "1aa55cfa9814522e7a34949b3c212e9188fd5ad89d96d8ab7fe9e4037a361b33"
        },
        "id": "quire.codegen-foundation-evidence-input",
        "version": "v1"
      },
      "uri": "collection-input.json"
    }
  ],
  "outputs": [
    {
      "contentDigest": {
        "algorithm": "sha256",
        "value": "76f849625251bf4153d7abbb9705a5f9afb8bbd35c5dcc827cca7ffc5b02a30e"
      },
      "mediaType": "application/json",
      "role": "codegen-foundation-evidence-manifest",
      "schema": {
        "digest": {
          "algorithm": "sha256",
          "value": "05e92a537a4def39d50e0050667200fae648284afef603bcbf2c0e014e9b5be5"
        },
        "id": "quire.codegen-foundation-evidence-manifest",
        "version": "v1"
      },
      "uri": "evidence-manifest.json"
    }
  ],
  "parametersDigest": {
    "algorithm": "sha256",
    "value": "22ace137375676acae2f430fa11b12c303a19cf5d993387bcb4973c69e401610"
  },
  "producer": {
    "executableDigest": {
      "algorithm": "sha256",
      "value": "0df6862a8700e53109b69a626d0cd963da8e5f274b8354f060ca764906919ac2"
    },
    "invocation": [
      "scripts/collect_foundation_evidence.sh",
      "evidence/foundation-51cf32624db0-20260830T223315Z"
    ],
    "name": "quire-contract-codegen-foundation-collector",
    "sourceRevision": "51cf32624db05d3f2bea9aeb3a3ffbf763b279e5",
    "version": "0.1.0"
  },
  "provenance": {
    "candidateRevision": "51cf32624db05d3f2bea9aeb3a3ffbf763b279e5",
    "contributionMethod": "agent-assisted",
    "repository": "https://github.com/agent-ix/quire-contract-codegen",
    "reviewers": [
      "@kreneskyp"
    ],
    "sourceRevision": "51cf32624db05d3f2bea9aeb3a3ffbf763b279e5"
  },
  "recordId": "foundation-51cf32624db0-20260830T223315Z",
  "recordedAt": "2026-08-30T22:33:16Z",
  "result": {
    "requirementRefs": [
      "PGM-01-R08",
      "PGM-01-R09",
      "MP-001"
    ],
    "status": "conclusive",
    "summary": "all collected codegen foundation checks passed; semantic claims are out of scope"
  },
  "schemaVersion": "quire.derivation-evidence/v1"
}
