{
  "backend": {
    "kind": "none",
    "reason": "deterministic foundation evidence packaging; invoked tools are identified in the input and manifest"
  },
  "environment": {
    "dependenciesDigest": {
      "algorithm": "sha256",
      "value": "b939cb6c694c3f9fba16ec2ed0696aca6f200c774e51f78d5515bc4802ae0de0"
    },
    "operatingSystem": "Linux-6.18.33.2-microsoft-standard-WSL2-x86_64-with-glibc2.35",
    "targetTriple": "x86_64-unknown-linux-gnu",
    "toolchain": "rustc 1.94.1 (e408947bf 2026-03-25)"
  },
  "extensions": {
    "dev.agent-ix.codegen": {
      "componentClass": "direct-development-tool",
      "envelopeSchemaDigest": "0946e235e9e4b0fa79e9b9ec27ae157b303c17de0a9408d3cc04968fb7152256",
      "pgm01CandidateRevision": "7dac9d8c19952412b56a0347387666e2ca81e01d",
      "phase": "foundation",
      "reviewState": "pending",
      "reviewerRole": "reviewer-of-record; not a GitHub approval",
      "sourceState": "clean",
      "historicalDisposition": {
        "authoritative": false,
        "reason": "superseded historical foundation record",
        "status": "retracted"
      }
    }
  },
  "inputs": [
    {
      "contentDigest": {
        "algorithm": "sha256",
        "value": "e8586f21a1c51e26ac2d383e1479a401c77a8921c5e01e577e0fc28eb6c6b931"
      },
      "mediaType": "application/json",
      "role": "foundation-evidence-collection-input",
      "schema": {
        "digest": {
          "algorithm": "sha256",
          "value": "a3e396b63985069a90962022167f010a33cbffb813fb7074c846665aa26cc0e3"
        },
        "id": "quire.codegen-foundation-evidence-input",
        "version": "v1"
      },
      "uri": "collection-input.json"
    },
    {
      "contentDigest": {
        "algorithm": "sha256",
        "value": "0946e235e9e4b0fa79e9b9ec27ae157b303c17de0a9408d3cc04968fb7152256"
      },
      "mediaType": "application/schema+json",
      "role": "pgm01-envelope-schema",
      "schema": {
        "digest": {
          "algorithm": "sha256",
          "value": "0946e235e9e4b0fa79e9b9ec27ae157b303c17de0a9408d3cc04968fb7152256"
        },
        "id": "quire.derivation-evidence",
        "version": "v1"
      },
      "uri": "https://github.com/agent-ix/quire-contract-ir/blob/7dac9d8c19952412b56a0347387666e2ca81e01d/schemas/derivation-evidence-envelope-v1.schema.json"
    },
    {
      "contentDigest": {
        "algorithm": "sha256",
        "value": "1c2881d5f8800dab031f6afa26d5ad11f88a5ab42a942bc9fe0c2853b58df2f1"
      },
      "mediaType": "text/x-python",
      "role": "pgm01-governance-validator",
      "schema": {
        "digest": {
          "algorithm": "sha256",
          "value": "1c2881d5f8800dab031f6afa26d5ad11f88a5ab42a942bc9fe0c2853b58df2f1"
        },
        "id": "python-source",
        "version": "v3"
      },
      "uri": "https://github.com/agent-ix/quire-contract-ir/blob/37eb00153d5c139ebc01622b6e12a4ab79256f88/scripts/validate_governance.py"
    }
  ],
  "outputs": [
    {
      "contentDigest": {
        "algorithm": "sha256",
        "value": "d2aaccfcfbe1c7c31fefebf26c37a3edfe705dd10791a5d98ac73ba4d6d69852"
      },
      "mediaType": "application/json",
      "role": "codegen-foundation-evidence-manifest",
      "schema": {
        "digest": {
          "algorithm": "sha256",
          "value": "05e92a537a4def39d50e0050667200fae648284afef603bcbf2c0e014e9b5be5"
        },
        "id": "quire.codegen-foundation-evidence-manifest",
        "version": "v1"
      },
      "uri": "evidence-manifest.json"
    }
  ],
  "parametersDigest": {
    "algorithm": "sha256",
    "value": "f3606c68f7cc251e695713740aef03848eac7bd239179748b5c02acb75d7ba64"
  },
  "producer": {
    "executableDigest": {
      "algorithm": "sha256",
      "value": "434feb03cc6b5e66711b045045a97e0038d67d0d3820a2221626b9ddeb6a508e"
    },
    "invocation": [
      "scripts/collect_foundation_evidence.sh",
      "evidence/foundation-984594e48a0c-20260831T172037Z"
    ],
    "name": "quire-contract-codegen-foundation-collector",
    "sourceRevision": "984594e48a0cab68c5852de7ff211a345d96bf17",
    "version": "0.1.0"
  },
  "provenance": {
    "candidateRevision": "984594e48a0cab68c5852de7ff211a345d96bf17",
    "contributionMethod": "agent-assisted",
    "repository": "https://github.com/agent-ix/quire-contract-codegen",
    "reviewers": [
      "@kreneskyp"
    ],
    "sourceRevision": "984594e48a0cab68c5852de7ff211a345d96bf17"
  },
  "recordId": "foundation-984594e48a0c-20260831T172037Z",
  "recordedAt": "2026-08-31T17:20:40Z",
  "result": {
    "requirementRefs": [
      "PGM-01-R08",
      "PGM-01-R09",
      "MP-001"
    ],
    "status": "pending",
    "summary": "1 foundation check outcomes are inconclusive"
  },
  "schemaVersion": "quire.derivation-evidence/v1"
}
