{
  "backend": {
    "kind": "none",
    "reason": "deterministic foundation evidence packaging; invoked tools are identified in the input and manifest"
  },
  "environment": {
    "dependenciesDigest": {
      "algorithm": "sha256",
      "value": "b939cb6c694c3f9fba16ec2ed0696aca6f200c774e51f78d5515bc4802ae0de0"
    },
    "operatingSystem": "Linux-6.18.33.2-microsoft-standard-WSL2-x86_64-with-glibc2.35",
    "targetTriple": "x86_64-unknown-linux-gnu",
    "toolchain": "rustc 1.94.1 (e408947bf 2026-03-25)"
  },
  "extensions": {
    "dev.agent-ix.codegen": {
      "componentClass": "direct-development-tool",
      "envelopeSchemaDigest": "0946e235e9e4b0fa79e9b9ec27ae157b303c17de0a9408d3cc04968fb7152256",
      "pgm01CandidateRevision": "0b8669b80f98b6c11954f922b32d9edae8a11983",
      "phase": "foundation",
      "reviewState": "pending",
      "sourceState": "clean",
      "historicalDisposition": {
        "authoritative": false,
        "reason": "superseded historical foundation record",
        "status": "retracted"
      }
    }
  },
  "inputs": [
    {
      "contentDigest": {
        "algorithm": "sha256",
        "value": "7e368cd2945a93e7a43cf2da5ebc76bb1bda9aba0ae221d6c3ff4481b050f9ba"
      },
      "mediaType": "application/json",
      "role": "foundation-evidence-collection-input",
      "schema": {
        "digest": {
          "algorithm": "sha256",
          "value": "1aa55cfa9814522e7a34949b3c212e9188fd5ad89d96d8ab7fe9e4037a361b33"
        },
        "id": "quire.codegen-foundation-evidence-input",
        "version": "v1"
      },
      "uri": "collection-input.json"
    }
  ],
  "outputs": [
    {
      "contentDigest": {
        "algorithm": "sha256",
        "value": "12891f8c9b69ce1dcaecb3edb730424206360040f20f725369a2a564d76dae10"
      },
      "mediaType": "application/json",
      "role": "codegen-foundation-evidence-manifest",
      "schema": {
        "digest": {
          "algorithm": "sha256",
          "value": "05e92a537a4def39d50e0050667200fae648284afef603bcbf2c0e014e9b5be5"
        },
        "id": "quire.codegen-foundation-evidence-manifest",
        "version": "v1"
      },
      "uri": "evidence-manifest.json"
    }
  ],
  "parametersDigest": {
    "algorithm": "sha256",
    "value": "791b10f2922118fbfd30cbdde999afbe8db7c4f553457a5ffe83ade881dd2c03"
  },
  "producer": {
    "executableDigest": {
      "algorithm": "sha256",
      "value": "d5dc89a5f3afe75606d94bd4506a212295c6574b5a5b8882953215bcfb02d540"
    },
    "invocation": [
      "scripts/collect_foundation_evidence.sh",
      "evidence/foundation-b90d6d5946e5-20260830T220017Z"
    ],
    "name": "quire-contract-codegen-foundation-collector",
    "sourceRevision": "b90d6d5946e5720bac32ed1b3c903cf727f57cae",
    "version": "0.1.0"
  },
  "provenance": {
    "candidateRevision": "b90d6d5946e5720bac32ed1b3c903cf727f57cae",
    "contributionMethod": "agent-assisted",
    "repository": "https://github.com/agent-ix/quire-contract-codegen",
    "reviewers": [
      "@kreneskyp"
    ],
    "sourceRevision": "b90d6d5946e5720bac32ed1b3c903cf727f57cae"
  },
  "recordId": "foundation-b90d6d5946e5-20260830T220017Z",
  "recordedAt": "2026-08-30T22:00:18Z",
  "result": {
    "requirementRefs": [
      "PGM-01-R08",
      "PGM-01-R09",
      "MP-001"
    ],
    "status": "conclusive",
    "summary": "all collected codegen foundation checks passed; semantic claims are out of scope"
  },
  "schemaVersion": "quire.derivation-evidence/v1"
}
