{
  "backend": {
    "kind": "none",
    "reason": "deterministic foundation evidence packaging; invoked tools are identified in the input and manifest"
  },
  "environment": {
    "dependenciesDigest": {
      "algorithm": "sha256",
      "value": "b939cb6c694c3f9fba16ec2ed0696aca6f200c774e51f78d5515bc4802ae0de0"
    },
    "operatingSystem": "Linux-6.18.33.2-microsoft-standard-WSL2-x86_64-with-glibc2.35",
    "targetTriple": "x86_64-unknown-linux-gnu",
    "toolchain": "rustc 1.94.1 (e408947bf 2026-03-25)"
  },
  "extensions": {
    "dev.agent-ix.codegen": {
      "componentClass": "direct-development-tool",
      "envelopeSchemaDigest": "0946e235e9e4b0fa79e9b9ec27ae157b303c17de0a9408d3cc04968fb7152256",
      "pgm01CandidateRevision": "0b8669b80f98b6c11954f922b32d9edae8a11983",
      "phase": "foundation",
      "reviewState": "pending",
      "sourceState": "clean"
    }
  },
  "inputs": [
    {
      "contentDigest": {
        "algorithm": "sha256",
        "value": "c69bbba19a282c03a84616ba3c514dc872f1837d894c3900da94cebc49129359"
      },
      "mediaType": "application/json",
      "role": "foundation-evidence-collection-input",
      "schema": {
        "digest": {
          "algorithm": "sha256",
          "value": "1aa55cfa9814522e7a34949b3c212e9188fd5ad89d96d8ab7fe9e4037a361b33"
        },
        "id": "quire.codegen-foundation-evidence-input",
        "version": "v1"
      },
      "uri": "collection-input.json"
    }
  ],
  "outputs": [
    {
      "contentDigest": {
        "algorithm": "sha256",
        "value": "4edf8350daedbb0950aae57d79a68b300af2150199bfe534bb1ff4f2e7bef1bc"
      },
      "mediaType": "application/json",
      "role": "codegen-foundation-evidence-manifest",
      "schema": {
        "digest": {
          "algorithm": "sha256",
          "value": "05e92a537a4def39d50e0050667200fae648284afef603bcbf2c0e014e9b5be5"
        },
        "id": "quire.codegen-foundation-evidence-manifest",
        "version": "v1"
      },
      "uri": "evidence-manifest.json"
    }
  ],
  "parametersDigest": {
    "algorithm": "sha256",
    "value": "0537b091546ea5fc090c37a67758192ff5d0803c049cc0aa3751097b844b8632"
  },
  "producer": {
    "executableDigest": {
      "algorithm": "sha256",
      "value": "467557e7804fb4a0a383f37aba270f5f0fb5730a727ac03ae2050d986e366586"
    },
    "invocation": [
      "scripts/collect_foundation_evidence.sh",
      "evidence/foundation-fcdcc0c1593b-20260830T220427Z"
    ],
    "name": "quire-contract-codegen-foundation-collector",
    "sourceRevision": "fcdcc0c1593b8194ec01cbda2a8562ed121d943d",
    "version": "0.1.0"
  },
  "provenance": {
    "candidateRevision": "fcdcc0c1593b8194ec01cbda2a8562ed121d943d",
    "contributionMethod": "agent-assisted",
    "repository": "https://github.com/agent-ix/quire-contract-codegen",
    "reviewers": [
      "@kreneskyp"
    ],
    "sourceRevision": "fcdcc0c1593b8194ec01cbda2a8562ed121d943d"
  },
  "recordId": "foundation-fcdcc0c1593b-20260830T220427Z",
  "recordedAt": "2026-08-30T22:04:28Z",
  "result": {
    "requirementRefs": [
      "PGM-01-R08",
      "PGM-01-R09",
      "MP-001"
    ],
    "status": "conclusive",
    "summary": "all collected codegen foundation checks passed; semantic claims are out of scope"
  },
  "schemaVersion": "quire.derivation-evidence/v1"
}
