{
  "backend": {
    "kind": "none",
    "reason": "deterministic foundation evidence packaging; invoked tools are identified in the input and manifest"
  },
  "environment": {
    "dependenciesDigest": {
      "algorithm": "sha256",
      "value": "b939cb6c694c3f9fba16ec2ed0696aca6f200c774e51f78d5515bc4802ae0de0"
    },
    "operatingSystem": "Linux-6.18.33.2-microsoft-standard-WSL2-x86_64-with-glibc2.35",
    "targetTriple": "x86_64-unknown-linux-gnu",
    "toolchain": "rustc 1.94.1 (e408947bf 2026-03-25)"
  },
  "extensions": {
    "dev.agent-ix.codegen": {
      "componentClass": "direct-development-tool",
      "envelopeSchemaDigest": "0946e235e9e4b0fa79e9b9ec27ae157b303c17de0a9408d3cc04968fb7152256",
      "pgm01CandidateRevision": "7f8130d3fdb160a98a7a7f445cc1eb7419a3c179",
      "phase": "foundation",
      "reviewState": "pending",
      "sourceState": "clean",
      "historicalDisposition": {
        "authoritative": false,
        "reason": "superseded historical foundation record",
        "status": "retracted"
      }
    }
  },
  "inputs": [
    {
      "contentDigest": {
        "algorithm": "sha256",
        "value": "faa90099eaf23e2320ca948dc1891919879190ff4913cc26d9d900415a08cad4"
      },
      "mediaType": "application/json",
      "role": "foundation-evidence-collection-input",
      "schema": {
        "digest": {
          "algorithm": "sha256",
          "value": "f0efc0b63f8d46258af397ff65bb52a16860d27086baa65c856cdbe96eeb51d7"
        },
        "id": "quire.codegen-foundation-evidence-input",
        "version": "v1"
      },
      "uri": "collection-input.json"
    }
  ],
  "outputs": [
    {
      "contentDigest": {
        "algorithm": "sha256",
        "value": "ed9e41bbb935c4763f5a1daec3fb9f3ee737c717bc28d8f3225a11c2afe855e2"
      },
      "mediaType": "application/json",
      "role": "codegen-foundation-evidence-manifest",
      "schema": {
        "digest": {
          "algorithm": "sha256",
          "value": "05e92a537a4def39d50e0050667200fae648284afef603bcbf2c0e014e9b5be5"
        },
        "id": "quire.codegen-foundation-evidence-manifest",
        "version": "v1"
      },
      "uri": "evidence-manifest.json"
    }
  ],
  "parametersDigest": {
    "algorithm": "sha256",
    "value": "6776aaac9e131af4f153bf7ef6d0faddc4c32c6860657e8cf94d47f826685659"
  },
  "producer": {
    "executableDigest": {
      "algorithm": "sha256",
      "value": "d7eb799332dfeb1223ff959fcf59cd68e0ac8fd1c720f3379e5611156bf466ea"
    },
    "invocation": [
      "scripts/collect_foundation_evidence.sh",
      "evidence/foundation-8a4537d32002-20260830T225332Z"
    ],
    "name": "quire-contract-codegen-foundation-collector",
    "sourceRevision": "8a4537d32002e1f2e984508ec8d89b300215855d",
    "version": "0.1.0"
  },
  "provenance": {
    "candidateRevision": "8a4537d32002e1f2e984508ec8d89b300215855d",
    "contributionMethod": "agent-assisted",
    "repository": "https://github.com/agent-ix/quire-contract-codegen",
    "reviewers": [
      "@kreneskyp"
    ],
    "sourceRevision": "8a4537d32002e1f2e984508ec8d89b300215855d"
  },
  "recordId": "foundation-8a4537d32002-20260830T225332Z",
  "recordedAt": "2026-08-30T22:53:34Z",
  "result": {
    "requirementRefs": [
      "PGM-01-R08",
      "PGM-01-R09",
      "MP-001"
    ],
    "status": "conclusive",
    "summary": "all collected codegen foundation checks passed; semantic claims are out of scope"
  },
  "schemaVersion": "quire.derivation-evidence/v1"
}
