{
  "backend": {
    "kind": "none",
    "reason": "deterministic foundation evidence packaging; invoked tools are identified in the input and manifest"
  },
  "environment": {
    "dependenciesDigest": {
      "algorithm": "sha256",
      "value": "b939cb6c694c3f9fba16ec2ed0696aca6f200c774e51f78d5515bc4802ae0de0"
    },
    "operatingSystem": "Linux-6.18.33.2-microsoft-standard-WSL2-x86_64-with-glibc2.35",
    "targetTriple": "x86_64-unknown-linux-gnu",
    "toolchain": "rustc 1.94.1 (e408947bf 2026-03-25)"
  },
  "extensions": {
    "dev.agent-ix.codegen": {
      "componentClass": "direct-development-tool",
      "envelopeSchemaDigest": "0946e235e9e4b0fa79e9b9ec27ae157b303c17de0a9408d3cc04968fb7152256",
      "pgm01CandidateRevision": "e928ce3703d238856544c65bc4aa7c30ea16dac1",
      "phase": "foundation",
      "reviewState": "pending",
      "sourceState": "clean",
      "historicalDisposition": {
        "authoritative": false,
        "reason": "superseded historical foundation record",
        "status": "retracted"
      }
    }
  },
  "inputs": [
    {
      "contentDigest": {
        "algorithm": "sha256",
        "value": "b23830e5544ecb7ef10deb03972fe86b864af88bf68ad93dd7c986fc6420eb94"
      },
      "mediaType": "application/json",
      "role": "foundation-evidence-collection-input",
      "schema": {
        "digest": {
          "algorithm": "sha256",
          "value": "f0efc0b63f8d46258af397ff65bb52a16860d27086baa65c856cdbe96eeb51d7"
        },
        "id": "quire.codegen-foundation-evidence-input",
        "version": "v1"
      },
      "uri": "collection-input.json"
    }
  ],
  "outputs": [
    {
      "contentDigest": {
        "algorithm": "sha256",
        "value": "2c672f26e4794c9250c4264a6b9864d1cf318d8cbf21a5bd1141e7072b04a8c7"
      },
      "mediaType": "application/json",
      "role": "codegen-foundation-evidence-manifest",
      "schema": {
        "digest": {
          "algorithm": "sha256",
          "value": "05e92a537a4def39d50e0050667200fae648284afef603bcbf2c0e014e9b5be5"
        },
        "id": "quire.codegen-foundation-evidence-manifest",
        "version": "v1"
      },
      "uri": "evidence-manifest.json"
    }
  ],
  "parametersDigest": {
    "algorithm": "sha256",
    "value": "32168935274099210420b358b52cd28914d8e7d3136894a3fcf377ee6bda788e"
  },
  "producer": {
    "executableDigest": {
      "algorithm": "sha256",
      "value": "d7eb799332dfeb1223ff959fcf59cd68e0ac8fd1c720f3379e5611156bf466ea"
    },
    "invocation": [
      "scripts/collect_foundation_evidence.sh",
      "evidence/foundation-3b3820cf5b6a-20260830T230214Z"
    ],
    "name": "quire-contract-codegen-foundation-collector",
    "sourceRevision": "3b3820cf5b6ab4591409dac4f22512437e165613",
    "version": "0.1.0"
  },
  "provenance": {
    "candidateRevision": "3b3820cf5b6ab4591409dac4f22512437e165613",
    "contributionMethod": "agent-assisted",
    "repository": "https://github.com/agent-ix/quire-contract-codegen",
    "reviewers": [
      "@kreneskyp"
    ],
    "sourceRevision": "3b3820cf5b6ab4591409dac4f22512437e165613"
  },
  "recordId": "foundation-3b3820cf5b6a-20260830T230214Z",
  "recordedAt": "2026-08-30T23:02:15Z",
  "result": {
    "requirementRefs": [
      "PGM-01-R08",
      "PGM-01-R09",
      "MP-001"
    ],
    "status": "conclusive",
    "summary": "all collected codegen foundation checks passed; semantic claims are out of scope"
  },
  "schemaVersion": "quire.derivation-evidence/v1"
}
