{
  "backend": {
    "kind": "none",
    "reason": "deterministic foundation evidence packaging; invoked tools are identified in the input and manifest"
  },
  "environment": {
    "dependenciesDigest": {
      "algorithm": "sha256",
      "value": "b939cb6c694c3f9fba16ec2ed0696aca6f200c774e51f78d5515bc4802ae0de0"
    },
    "operatingSystem": "Linux-6.18.33.2-microsoft-standard-WSL2-x86_64-with-glibc2.35",
    "targetTriple": "x86_64-unknown-linux-gnu",
    "toolchain": "rustc 1.94.1 (e408947bf 2026-03-25)"
  },
  "extensions": {
    "dev.agent-ix.codegen": {
      "componentClass": "direct-development-tool",
      "envelopeSchemaDigest": "0946e235e9e4b0fa79e9b9ec27ae157b303c17de0a9408d3cc04968fb7152256",
      "pgm01CandidateRevision": "7dac9d8c19952412b56a0347387666e2ca81e01d",
      "phase": "foundation",
      "reviewState": "pending",
      "sourceState": "clean",
      "historicalDisposition": {
        "authoritative": false,
        "reason": "superseded historical foundation record",
        "status": "retracted"
      }
    }
  },
  "inputs": [
    {
      "contentDigest": {
        "algorithm": "sha256",
        "value": "50e81d7460f24fcc733e5926d0fcb19781bfdd665aba40501031816eeef22861"
      },
      "mediaType": "application/json",
      "role": "foundation-evidence-collection-input",
      "schema": {
        "digest": {
          "algorithm": "sha256",
          "value": "a3e396b63985069a90962022167f010a33cbffb813fb7074c846665aa26cc0e3"
        },
        "id": "quire.codegen-foundation-evidence-input",
        "version": "v1"
      },
      "uri": "collection-input.json"
    },
    {
      "contentDigest": {
        "algorithm": "sha256",
        "value": "0946e235e9e4b0fa79e9b9ec27ae157b303c17de0a9408d3cc04968fb7152256"
      },
      "mediaType": "application/schema+json",
      "role": "pgm01-envelope-schema",
      "schema": {
        "digest": {
          "algorithm": "sha256",
          "value": "0946e235e9e4b0fa79e9b9ec27ae157b303c17de0a9408d3cc04968fb7152256"
        },
        "id": "quire.derivation-evidence",
        "version": "v1"
      },
      "uri": "https://github.com/agent-ix/quire-contract-ir/blob/7dac9d8c19952412b56a0347387666e2ca81e01d/schemas/derivation-evidence-envelope-v1.schema.json"
    },
    {
      "contentDigest": {
        "algorithm": "sha256",
        "value": "1c2881d5f8800dab031f6afa26d5ad11f88a5ab42a942bc9fe0c2853b58df2f1"
      },
      "mediaType": "text/x-python",
      "role": "pgm01-governance-validator",
      "schema": {
        "digest": {
          "algorithm": "sha256",
          "value": "1c2881d5f8800dab031f6afa26d5ad11f88a5ab42a942bc9fe0c2853b58df2f1"
        },
        "id": "python-source",
        "version": "v3"
      },
      "uri": "https://github.com/agent-ix/quire-contract-ir/blob/37eb00153d5c139ebc01622b6e12a4ab79256f88/scripts/validate_governance.py"
    }
  ],
  "outputs": [
    {
      "contentDigest": {
        "algorithm": "sha256",
        "value": "a274697615b01a6375e3ffb3abfe3c8e58ac9a856d5e5e8357aad64e92cf4def"
      },
      "mediaType": "application/json",
      "role": "codegen-foundation-evidence-manifest",
      "schema": {
        "digest": {
          "algorithm": "sha256",
          "value": "05e92a537a4def39d50e0050667200fae648284afef603bcbf2c0e014e9b5be5"
        },
        "id": "quire.codegen-foundation-evidence-manifest",
        "version": "v1"
      },
      "uri": "evidence-manifest.json"
    }
  ],
  "parametersDigest": {
    "algorithm": "sha256",
    "value": "34803f3d9bfdd75dd987dedddda3b1b44f7045c22d451322f2eb6e618f64d931"
  },
  "producer": {
    "executableDigest": {
      "algorithm": "sha256",
      "value": "f30e341707826b52d3b9040f1bfd4bc33da6b8f39ae2e00741c1801a099c9bde"
    },
    "invocation": [
      "scripts/collect_foundation_evidence.sh",
      "evidence/foundation-cf40e894221c-20260831T163108Z"
    ],
    "name": "quire-contract-codegen-foundation-collector",
    "sourceRevision": "cf40e894221c1028b70e01cbaff56bf64512b809",
    "version": "0.1.0"
  },
  "provenance": {
    "candidateRevision": "cf40e894221c1028b70e01cbaff56bf64512b809",
    "contributionMethod": "agent-assisted",
    "repository": "https://github.com/agent-ix/quire-contract-codegen",
    "reviewers": [
      "@kreneskyp"
    ],
    "sourceRevision": "cf40e894221c1028b70e01cbaff56bf64512b809"
  },
  "recordId": "foundation-cf40e894221c-20260831T163108Z",
  "recordedAt": "2026-08-31T16:31:10Z",
  "result": {
    "requirementRefs": [
      "PGM-01-R08",
      "PGM-01-R09",
      "MP-001"
    ],
    "status": "conclusive",
    "summary": "all executed codegen foundation checks passed; semantic claims are out of scope"
  },
  "schemaVersion": "quire.derivation-evidence/v1"
}
